<?xml version="1.0" encoding="UTF-8"?>
<!DOCTYPE profiles PUBLIC "-//FERMENTER//DTD PROFILES//EN" "https://bitbucket.org/askllc/fermenter/downloads/profiles.dtd">

<profiles>

	<profile name="ejbFactories">
		<target name="ejbServiceFactory"/>
	</profile>

	<profile name="java-service-session-beans" extends="ejbFactories">
		<target name="serviceSessionBeanRemoteInterfaces"/>
		<target name="serviceSessionBeanLocalInterfaces"/>
		<target name="serviceSessionBeanHomeInterfaces"/>
		<target name="serviceSessionBeanLocalHomeInterfaces"/>
		<target name="serviceSessionBeanObjects"/>
		<target name="sessionBeanServiceDelegateObjects"/>
	</profile>

	<profile name="java-entity-maintenance-session-beans-service-only" extends="ejbFactories">
		<target name="entityMaintenanceServiceLocal"/>
		<target name="entityMaintenanceServiceBean"/>
	</profile>

	<profile name="java-entity-maintenance-session-beans" extends="java-entity-maintenance-session-beans-service-only">
		<target name="sessionBeanEntityMaintenanceServiceDelegateImpl"/>
	</profile>

</profiles>