<?xml version="1.0" encoding="UTF-8"?>
<!DOCTYPE profiles PUBLIC "-//FERMENTER//DTD PROFILES//EN" "https://bitbucket.org/askllc/fermenter/downloads/profiles.dtd">

<profiles>
	<profile name="java-hibernate">
		<target name="baseDataAccessObjectHibernateImpls"/>
		<target name="dataAccessObjectHibernateImpls"/>
		<target name="hibernateMappings"/>
		<target name="daoFactoryHibernate"/>
		<target name="factoryPropertiesHibernate"/>
		<target name="hibernateConfigXml"/>
		<target name="hibernateProperties"/>
		<target name="resourcesPropertiesHibernate"/>
	</profile>
</profiles>