<?xml version="1.0" encoding="UTF-8"?>
<!DOCTYPE profiles PUBLIC "-//ATLAS//DTD PROFILES//EN" "http://atlas.tigris.org/svn/atlas/trunk/atlas-mda/src/main/resources/profiles.dtd">

<profiles>
	<profile name="java-hibernate">
		<target name="enumerationHibernateUserTypeObjects"/>
		<target name="dataAccessObjectHibernateImpls"/>
		<target name="ddlAntTaskGenerator"/>
		<target name="hibernateMappings"/>
		<target name="daoFactoryHibernate"/>
		<target name="factoryPropertiesHibernate"/>
		<target name="hibernateConfigXml"/>
		<target name="hibernateProperties"/>
		<target name="resourcesPropertiesHibernate"/>
	</profile>
</profiles>