<?xml version="1.0" encoding="UTF-8"?>
<!DOCTYPE profiles PUBLIC "-//FERMENTER//DTD PROFILES//EN" "https://bitbucket.org/askllc/fermenter/downloads/profiles.dtd">

<profiles>
	<profile name="objective-c-base">
		<target name="objective-c-entity-header"/>
		<target name="objective-c-entity-source"/>
		<target name="objective-c-enumeration-header"/>
		<target name="objective-c-enumeration-source"/>
		<target name="objective-c-service-response-header"/>
		<target name="objective-c-service-response-source"/>
	</profile>
</profiles>